name,url,description,registry,related_pages
Open Definition Conformant Licenses,https://opendefinition.org/licenses/,Licenses that are conformant with the principles laid out in the Open Definition.,,"licensing, researcher, data_manager, policy_officer"
OpenAIRE Explore,https://explore.openaire.eu/search/find,Explore Open Access research outcomes from OpenAIRE network,,existing_data
OpenEBench,https://openebench.bsc.es/,ELIXIR benchmarking platform to support community-led scientific benchmarking efforts and the technical monitoring of bioinformatics reosurces,biotools:openebench,"data_analysis, data_manager, it_support"
OpenRefine,https://openrefine.org/,Data curation tool for working with messy data,,data_quality
OpenScienceFramework,https://osf.io/,"free and open source project management tool that supports the entire research lifecycle: planning, execution, reporting, archiving, and discovery",fairsharing:g4z879,"data_publication, biomol_sim"
OpenStack,https://www.openstack.org/,OpenStack is an open source cloud computing infrastructure software project and is one of the three most active open source projects in the world,,"storage, data_analysis, transmed, ifb"
Orphadata,http://www.orphadata.org/cgi-bin/index.php,"The Orphadata platform provides the scientific community with comprehensive, high-quality datasets related to rare diseases and orphan drugs, in a reusable and computable format",fairsharing-coll:bsg-d001249,
OSF,https://osf.io,"OSF (Open Science Framework) is a free, open platform to support your research and enable collaboration.",,"storage, researcher, data_manager"
OTP,https://gitlab.com/one-touch-pipeline/otp,"One Touch Pipeline (OTP) is a data management platform for running bioinformatics pipelines in a high-throughput setting, and for organising the resulting data and metadata.",,"human_data, metadata, dmp, data_analysis"
ownCloud,https://owncloud.com,Cloud storage and file sharing service,,"storage, it_support, transfer, data_analysis"
PAA,https://bioconductor.org/packages/PAA/,PAA is an R/Bioconductor tool for protein microarray data analysis aimed at biomarker discovery.,biotools:paa,"data_analysis, researcher, human_data, proteomics"
PANGAEA,https://www.pangaea.de/,Data Publisher for Earth and Environmental Science,biotools:pangaea,"data_publication, metadata, researcher, data_manager"
PCDDB,https://pcddb.cryst.bbk.ac.uk/,The Protein Circular Dichroism Data Bank,biotools:pcddb,"idp, researcher"
PDB,https://www.wwpdb.org/,The Protein Data Bank (PDB),biotools:pdb,"researcher, idp, struct_bioinfo"
PDB-Dev,https://pdb-dev.wwpdb.org/,Prototype archiving system for structural models obtained using integrative or hybrid modeling,,"biomol_sim, struct_bioinfo"
PDBx/mmCIF format and tools,https://mmcif.wwpdb.org/,"Information about the standard PDB archive format PDBx/mmCIF, its dictionaries and related software tools",fairsharing:fd28en,struct_bioinfo
PDBx/mmCIF ModelCIF Extension Dictionary,https://mmcif.wwpdb.org/dictionaries/mmcif_ma.dic/Index/,Extension of the PDBx/mmCIF dictionary for theoretical models of macromolecular structures,,struct_bioinfo
PharmGKB,https://www.pharmgkb.org/,A resource that curates knowledge about the impact of genetic variation on drug response.,biotools:pharmgkb,toxicology_data
Pharos,https://pharosproject.net/,"Pharos provides hazard, use, and exposure information on 140,872 chemicals and 180 different kinds of building products.",biotools:pharos,toxicology_data
PHIS,http://www.phis.inra.fr/,The open-source Phenotyping Hybrid Information System (PHIS) manages and collects data from plants phenotyping and high throughput phenotyping experiments on a day to day basis.,,"plant_pheno_assembly, plants, ifb"
PIA - Protein Inference Algorithms,https://github.com/mpc-bioinformatics/pia,PIA is a toolbox for mass spectrometrey based protein inference and identification analysis.,biotools:pia,"data_analysis, researcher, proteomics"
pISA-tree,https://github.com/NIB-SI/pISA-tree,"A data management solution for intra-institutional organization and structured storage of life science project-associated research data, with emphasis on the generation of adequate metadata.",biotools:pisa-tree,"plants, micro_biotech, researcher, data_manager, data_organisation, metadata, plant_pheno_assembly"
PLAZA,https://bioinformatics.psb.ugent.be/plaza/,"Access point for plant comparative genomics, centralizing genomic data produced by different genome sequencing initiatives.",fairsharing:wBOua0,"plants, plant_geno_assembly, researcher"
PMut,http://mmb.irbbarcelona.org/PMut,Platform for the study of the impact of pathological mutations in protein stuctures.,biotools:pmut,"data_analysis, human_data"
PRIDE,https://www.ebi.ac.uk/pride/,PRoteomics IDEntifications (PRIDE) Archive database,fairsharing:e1byny,proteomics
ProteomeXchange,http://www.proteomexchange.org/,ProteomeXchange provides globally coordinated standard data submission and dissemination pipelines,fairsharing:92dt9d,proteomics
Proteomics Standards Initiative,https://www.psidev.info/,"The HUPO Proteomics Standards Initiative defines community standards for data representation in proteomics and interactomics to facilitate data comparison, exchange and verification.",,proteomics
protocols.io,https://www.protocols.io,A secure platform for developing and sharing reproducible methods.,,micro_biotech
PROV-DM: The PROV Data Model,https://www.w3.org/TR/prov-dm/,PROV-DM is the conceptual data model that forms a basis for the W3C provenance (PROV) family of specifications.,,data_provenance
R Markdown,https://rmarkdown.rstudio.com,"R Markdown documents are fully reproducible. Use a productive notebook interface to weave together narrative text and code to produce elegantly formatted output. Use multiple languages including R, Python, and SQL.",,"data_analysis, researcher"
RD-Connect Genome Phenome Analysis Platform,https://rd-connect.eu/what-we-do/omics/gpap/,The RD-Connect GPAP is an online tool for diagnosis and gene discovery in rare disease research.,,"researcher, human_data"
RDA Standards,https://rd-alliance.github.io/metadata-directory/standards/,"Directory of standard metadata, divided into different research areas",,"metadata, researcher, data_manager"
re3data,https://www.re3data.org/,Registry of Research Data Repositories,,existing_data
REACH registered substances,https://echa.europa.eu/information-on-chemicals/registered-substances,"Portal with public data submitted to ECHA in REACH registration dossiers by substance manufacturers, importers, or their representatives, as laid out by the REACH Regulation (see Understanding REACH regulation).",,toxicology_data
REDCap,https://projectredcap.org,"REDCap is a secure web application for building and managing online surveys and databases. While REDCap can be used to collect virtually any type of data in any environment, it is specifically geared to support online and offline data capture for research studies and operations.",biotools:redcap,"identifiers, it_support, data_manager, data_quality"
REDIportal,http://srv00.recas.ba.infn.it/atlas/,"Database of A-to-I (deamination of adenosines to inosines) events that enables to search RNA editing sites by genomic region, gene name and other relevant features as the tissue of origin.",biotools:rediportal,epitrans
REDItools,https://github.com/BioinfoUNIBA/REDItools,Python scripts to detect RNA editing events in RNAseq experiments,biotools:reditools,epitrans
REDItools2,https://github.com/BioinfoUNIBA/REDItools2,"REDItools2 is the optimized, parallel multi-node version of REDItools.",,epitrans
REMS,https://github.com/CSCfi/rems,"REMS (Resource Entitlement Management System), developed by CSC, is a tool that can be used to manage researchers’ access rights to datasets.",biotools:rems,"it_support, transmed"
Renamer4Mac,https://renamer.com/,File renaming software for Mac,,"data_organisation, data_manager, researcher"
Repository Finder,https://repositoryfinder.datacite.org,Repository Finder can help you find an appropriate repository to deposit your research data. The tool is hosted by DataCite and queries the re3data registry of research data repositories.,,"data_publication, researcher, data_manager"
Research Data Management Organiser,https://rdmorganiser.github.io/en,"Supports the systematic planning, organisation and implementation of research data management throughout the course of a project",,"dmp, researcher, data_manager, it_support"
Research Data Management Platform (RDMP),https://www.dundee.ac.uk/hic/data-team/researchdatamanagementplatform/,"Data management platform for automated loading, storage, linkage and provision of data sets",biotools:rdmp,"storage, it_support"
Research Management Plan,https://researcheracademy.elsevier.com/research-preparation/research-data-management/creating-good-research-data-management-plan,Machine actionable DMPs.,,"dmp, researcher, data_manager"
Research Object Crate (RO-Crate),https://w3id.org/ro/crate,"RO-Crate is a lightweight approach to packaging research data with their metadata, using schema.org. An RO-Crate is a structured archive of all the items that contributed to the research outcome, including their identifiers, provenance, relations and annotations.",fairsharing:wUoZKE,"metadata, storage, data_organisation, data_manager, researcher, micro_biotech, machine_actionability, data_provenance"
Reva,https://reva.link/,Reva connects cloud storages and application providers,,"data_analysis, transfer"
Rightfield,https://rightfield.org.uk,RightField is an open-source tool for adding ontology term selection to Excel spreadsheets,,"researcher, metadata, data_manager, micro_biotech, identifiers, machine_actionability"
Rstudio,https://rstudio.com,"Rstudio notebooks allow to share code, documentation",,"data_analysis, it_support, researcher"
Rucio,https://rucio.cern.ch/,Rucio - Scientific Data Management,,"storage, data_analysis, transfer"
RxNorm,https://www.nlm.nih.gov/research/umls/rxnorm/index.html,RxNorm is a normalized naming system for medications that is maintained by the National Library of Medicine. Rxnorm provides unique identifiers and allows unambiguous communication of drug-related information across the American health computer systems.,biotools:rxnorm,toxicology_data
salDB,https://mmp.sfb.uit.no/databases/saldb/,SalDB is a salmon specific database of genome sequenced prokaryotes representing the microbiota of fishes found in the taxonomic family of Salmonidae.,,marine_assembly
SASBDB,https://www.sasbdb.org/,Small Angle Scattering Biological Data Bank,,"idp, researcher"
SBOL Visual,https://sbolstandard.org/visual-glyphs/,A standard library of visual glyphs used to represent SBOL designs and interactions.,,micro_biotech
SBOLDesigner,https://sboldesigner.github.io,A CAD tool to create SBOL designs through the use of SBOL Visual glyphs.,,micro_biotech
Schema.org,https://schema.org,"Schema.org is a collaborative, community activity with a mission to create, maintain, and promote schemas for structured data on the Internet, on web pages, in email messages, and beyond.",,"machine_actionability, it_support"
Schemapedia,https://schemapedia.com,Web portal for finding ontologies,,"metadata, data_manager, researcher"
ScienceMesh,https://sciencemesh.io/,ScienceMesh - frictionless scientific collaboration and access to research services,,"storage, data_analysis, transfer"
Scientific Data's Recommended Repositories,https://www.nature.com/sdata/policies/repositories,"List of respositories recommended by Scientific Data, contains both discipline-specific and general repositories.",,"data_publication, researcher, data_manager, it_support"
SeaFile,https://www.seafile.com/,SeaFile File Synchronization and Share Solution,,"storage, transfer"
Semantic data model of the set of common data elements for rare diseases registration,https://github.com/ejp-rd-vp/CDE-semantic-model,A semantic data model describing the common data elements for rare diseases registration.,,rare_disease
semares,www.genevention.com/products,"All-in-one platform for life science data management, semantic data integration, data analysis and visualization",,"researcher, data_manager, metadata, data_analysis, it_support, storage"
Set of common data elements for rare diseases registration,https://eu-rd-platform.jrc.ec.europa.eu/set-of-common-data-elements_en,"Contains 16 data elements to be registered by each rare disease registry across Europe, which are considered to be essential for further research.",,rare_disease
ShortBOL,http://shortbol.org,A scripting language for creating Synthetic Biology Open Language (SBOL) in a more abstract way.,,micro_biotech
SIFTS,https://www.ebi.ac.uk/pdbe/docs/sifts/,"Structure integration with function, taxonomy and sequence",,"researcher, idp"
Silva,https://www.arb-silva.de/,"SILVA provides comprehensive, quality checked and regularly updated datasets of aligned small (16S/18S, SSU) and large subunit (23S/28S, LSU) ribosomal RNA (rRNA) sequences for all three domains of life (Bacteria, Archaea and Eukarya).",fairsharing:5vtYGG,
Singularity,https://sylabs.io,Singularity is a container platform.,,"it_support, data_analysis, tsd"
SMASCH,https://smasch.pages.uni.lu,"SMASCH (Smart Scheduling) system, is a web-based tooldesigned for longitudinal clinical studies requiring recurrent follow-upvisits of the participants. SMASCH controls and simplifies the scheduling of big database of patients. Smasch is also used to organize the daily plannings (delegation of tasks) for the different medical professionals such as doctors, nurses and neuropsychologists.",,"data_organisation, transmed"
Snakemake,https://snakemake.github.io,Snakemake is a framework for data analysis workflow execution,biotools:snakemake,"it_support, data_analysis"
SSBD:database,https://ssbd.riken.jp/database/,Added-value database for biological dynamics images,,"bioimaging_data, data_publication"
SSBD:repository,https://ssbd.riken.jp/repository/,An open data archive that stores and publishes bioimaging and biological quantitative datasets,,"bioimaging_data, data_publication"
Standards for Reporting Enzyme Data (STRENDA),https://www.beilstein-institut.de/en/projects/strenda/,Resource of standards for reporting enzyme data,,micro_biotech
STRING,https://string-db.org/,Known and predicted protein-protein interactions.,fairsharing:9b7wvk,proteomics
SynBioHub,https://synbiohub.org,A searchable design repository for biological constructs,,micro_biotech
Synthetic Biology Open Language (SBOL),https://sbolstandard.org,An open standard for the representation of in silico biological designs and their place in the Design-Build-Test-Learn cycle of synthetic biology.,,micro_biotech
Systems Biology Markup Language (SBML),http://sbml.org/Main_Page,An open format for computational models of biological processes,,micro_biotech
T3DB,http://www.t3db.ca/,"The Toxin and Toxin Target Database is a bioinformatics resource that combines exhaustive toxin data with toxin target information. Currently it presents more than 42,000 toxin-target associations extracted from other databases, government documents, books and scientific literature. Each toxin record includes data on chemical properties and descriptors, toxicity values and medical information.",biotools:t3db,toxicology_data
Talend,https://www.talend.com/,Talend is an open source data integration platform.,,"data_manager, researcher, transmed"
TG-GATES,https://toxico.nibiohn.go.jp/english/,"A toxicogenomics database that stores gene expression data and biochemistry, hematology, and histopathology findings derived from in vivo (rat) and in vitro (primary rat hepatocytes, primary human hepatocytes) exposure to 170 compounds at multiple dosages and time points.",biotools:open_tg-gates,toxicology_data
The Environment Ontology (EnvO),https://sites.google.com/site/environmentontology/,An ontology for expressing environmental terms,,micro_biotech
The European Genome-phenome Archive (EGA),https://ega-archive.org/,EGA is a service for permanent archiving and sharing of all types of personally identifiable genetic and phenotypic data resulting from biomedical research projects,"biotools:ega, fairsharing:mya1ff","data_publication, human_data, policy_officer, csc, tsd"
The Genomic Standards Consortium (GSC),https://gensc.org/mixs/,Minimum Information about any (x) Sequence,"fairsharing:9aa0zp, biotools:NA","metadata, researcher, it_support, policy_officer, human_data"
The Open Biological and Biomedical Ontology (OBO) Foundry,http://obofoundry.org,Collaborative effort to develob interoperable ontologies for the biological sciences,fairsharing-coll:bsg-d001083,"metadata, data_manager, researcher"
Tox21_Toolbox,https://ntp.niehs.nih.gov/whatwestudy/tox21/toolbox/index.html,"The Toxicology in the 21st Century program, or Tox21, is a unique collaboration between several federal agencies to develop new ways to rapidly test whether substances adversely affect human health. The Tox21 Toolbox contains data-analysis tools for accessing and visualizing Tox21 quantitative high-throughput screening (qHTS) 10K library data, as well as integrating with other publicly available data.",,toxicology_data
ToxCast_data,https://www.epa.gov/chemical-research/exploring-toxcast-data-downloadable-data,"The Toxicology in the 21st Century program, or Tox21, is a unique collaboration between several federal agencies to develop new ways to rapidly test whether substances adversely affect human health. This portal contains diverse downloadable results of the ToxCast project.",,toxicology_data
TOXNET,https://www.nlm.nih.gov/toxnet/index.html,"The Toxicology Data Network (TOXNET) was a portal that allowed access to several relevant sources in the toxicological field. Nowadays, these sources have been integrated into other NLM resources.",,toxicology_data
tranSMART,https://github.com/transmart,"Knowledge management and high-content analysis platform enabling analysis of integrated data for the purposes of hypothesis generation, hypothesis validation, and cohort discovery in translational research.",biotools:transmart,"researcher, data_manager, data_analysis, storage, transmed"
Tryggve ELSI Checklist,https://scilifelab-data-guidelines.readthedocs.io/en/latest/docs/general/sensitive_data.html,"A list of Ethical, Legal, and Societal Implications (ELSI) to consider for research projects on human subjects",,"sensitive, policy_officer, data_manager, human_data, nels, csc, tsd"
TXG-MAPr,https://txg-mapr.eu/,"A tool that contains weighted gene co-expression networks obtained from the Primary Human Hepatocytes, rat kidney, and liver TG-GATEs dataset.",,"data_analysis, researcher, toxicology_data"
UMLS,https://www.nlm.nih.gov/research/umls/index.html,The Unified Medical Language System (UMLS) is a set of tools that establishes a mapping structure among different vocabularies in the biomedical sciences field to enable interoperativity between computer systems.,,toxicology_data
UniChem,https://www.ebi.ac.uk/unichem/,"UniChem is a very simple, large-scale non-redundant database of pointers between chemical structures and EMBL-EBI chemistry resources. Primarily, this service has been designed to maintain cross references between EBI chemistry resources. These include primary chemistry resources (ChEMBL and ChEBI), and other resources where the main focus is not small molecules, but which may nevertheless contain some small molecule information (eg: Gene Expression Atlas, PDBe).",,toxicology_data
UniProt,https://www.uniprot.org/,Comprehensive resource for protein sequence and annotation data,fairsharing:s1ne3g,"metadata, researcher, idp, micro_biotech, proteomics, struct_bioinfo"
University of Cambridge - Electronic Research Notebook Products,https://www.data.cam.ac.uk/data-management-guide/electronic-research-notebooks/electronic-research-notebook-products,List of Electronic Research Notebook Products by University of Cambridge,,"metadata, identifiers, researcher, data_manager"
VisBOL,http://visbol.org,A JavaScript library for the visualisation of SBOL.,,micro_biotech
Wellcome Open Research - Data Guidelines,https://wellcomeopenresearch.org/for-authors/data-guidelines,"Wellcome Open Research requires that the source data underlying the results are made available as soon as an article is published. This page provides information about data you need to include, where your data can be stored, and how your data should be presented.",,"data_publication, researcher, data_manager"
WinSCP,https://winscp.net/eng/index.php,"WinSCP is a popular SFTP client and FTP client for Microsoft Windows! Copy file between a local computer and remote servers using FTP, FTPS, SCP, SFTP, WebDAV or S3 file transfer protocols.",,"transfer, it_support"
WorkflowHub,https://workflowhub.eu,"WorkflowHub is a registry for describing, sharing and publishing scientific computational workflows.",,"data_publication, data_manager, researcher"
XNAT,https://www.xnat.org/,"Open source imaging informatics platform. It facilitates common management, productivity, and quality assurance tasks for imaging and associated data.",,"researcher, data_analysis, transmed, xnat-pic, bioimaging_data"
XNAT-PIC Pipelines,https://github.com/szullino/XNAT-PIC,Analysing of single or multiple subjects within the same project in XNAT,,"researcher, data_manager, data_analysis, xnat-pic"
XNAT-PIC Uploader,https://github.com/szullino/XNAT-PIC,Import tool for multimodal DICOM image datasets to XNAT,,"researcher, data_manager, xnat-pic"
Zenodo,https://zenodo.org/,Generalist research data repository built and developed by OpenAIRE and CERN,fairsharing:wy4egf,"data_publication, biomol_sim, bioimaging_data, plant_pheno_assembly"
Zooma,https://www.ebi.ac.uk/spot/zooma/,Find possible ontology mappings for free text terms in the ZOOMA repository.,,"metadata, data_manager, researcher"
