name,url,description,registry,related_pages
European Joint Programme on Rare Diseases Metadata Model,https://github.com/ejp-rd-vp/resource-metadata-schema,"This core model is designed to represent data about a rare disease patient and biosample registries. The model is based on and builds on existing standards, such as the European Rare Disease Registry Infrastructure and the Common Data Elements from the rare disease community and other more generalised standards for data sharing such as the W3C DCAT vocabulary.",,rare_disease
European Joint Programme on Rare Diseases Virtual Platform (EJP RD),https://vp.ejprarediseases.org/,"The Virtual Platform is a federated ecosystem, in which resources are enhanced to be amenable to rare disease research, and made Findable, Accessible, Interoperable and Reusable: data stays at the source level but can be queyrable at distance from an EJP RD query point.",,rare_disease
European Nucleotide Archive (ENA),https://www.ebi.ac.uk/ena/browser/home,A record of sequence information scaling from raw sequcning reads to assemblies and functional annotation,fairsharing:dj8nt8,"micro_biotech, plant_geno_assembly, data_brokering"
European Rare Disease Registry Infrastructure directory of registries (ERDRI.dor),https://eu-rd-platform.jrc.ec.europa.eu/erdridor/,ERDRI.dor provides an overview of participating rare disease registries with their main characteristics and description.,,rare_disease
European Rare Disease Registry Infrastructure metadata repository (ERDRI.mdr),https://eu-rd-platform.jrc.ec.europa.eu/mdr/,"ERDRI.mdr serves to ease the integration of heterogeneous data from different rare disease registries. For this purpose, it contains a collection of metadata which specifies the used data elements of a registry including the designation of the used data elements, their definition and units of measurement.",,rare_disease
European Reference Networks (ERNs),https://health.ec.europa.eu/european-reference-networks_en,"Virtual networks involving healthcare providers across Europe. They aim to facilitate discussion on complex or rare diseases and conditions that require highly specialised treatment, and concentrated knowledge and resources.",,rare_disease
European Variation Archive (EVA),https://www.ebi.ac.uk/eva/,Open-access database of all types of genetic variation data from all species.,fairsharing:6824pv,plant_geno_assembly
Evidence and Conclusion Ontology (ECO),https://evidenceontology.org/,Controlled vocabulary that describes types of evidence and assertion methods,"fairsharing:wvpgwn, biotools:NA","existing_data, metadata"
FAERS,https://www.fda.gov/drugs/surveillance/questions-and-answers-fdas-adverse-event-reporting-system-faers,"The FDA Adverse Event Reporting System (FAERS) is an american resource that contains adverse event reports, medication error reports and product quality complaints submitted by healthcare professionals, consumers, and manufacturers. MedDRA ontology is used for coding adverse effects. Note that reports available in FAERS do not require a causal relationship between a product and an adverse event and further evaluations are conducted by FDA to monitor the safety of products.",biotools:faers,toxicology_data
FAIDARE,https://urgi.versailles.inra.fr/faidare/,FAIDARE is a tool allowing to search data across dinstinct databases that implemented BrAPI.,biotools:faidare,"researcher, data_manager, plants, ifb, plant_pheno_assembly"
FAIR Cookbook,https://fairplus.github.io/the-fair-cookbook/content/recipes/assessing-fairness.html#,"FAIR Cookbook is an online resource for the Life Sciences with recipes that help you to make and keep data Findable, Accessible, Interoperable and Reusable (FAIR)",,"compliance, data_manager, transmed"
FAIR Data Point (FDP),https://www.fairdatapoint.org/,A FAIR Data Point stores metadata in a standardized and sharable way.,fairsharing:298,"rare_disease, metadata, it_support"
FAIR Evaluation Services,https://fairsharing.github.io/FAIR-Evaluator-FrontEnd/#!/#%2F!,Resources and guidelines to assess the FAIRness of digital resources.,,"compliance, data_manager, policy_officer"
FAIR Implementation Profile,https://www.go-fair.org/how-to-go-fair/fair-implementation-profile/,The FIP is a collection of FAIR implementation choices made by a community of practice for each of the FAIR Principles. ,,"dm_coordination, dmp, researcher, data_manager"
FAIR-Wizard,https://wwwdev.ebi.ac.uk/ait/fair-wizard/home,"The FAIR wizard utilizes FAIRification resources developed by the FAIRplus project and other platforms, suggests FAIRification materials based on the FAIRification requirements, and designs FAIRification solutions for data owners, data stewards, and other people involved in FAIRification.",,"compliance, data_manager, policy_officer"
FAIRassist.org,https://fairassist.org/#!/,Help you discover resources to measure and improve FAIRness.,,"compliance, data_manager, policy_officer"
FAIRDOM-SEEK,https://seek4science.org/,"A data Management Platform for organising, sharing and publishing research datasets, models, protocols, samples, publications and other research outcomes.",biotools:seek,"storage, it_support, nels, micro_biotech, ifb, machine_actionability, plant_pheno_assembly"
FAIRDOMHub,https://fairdomhub.org,"Data, model and SOPs management for projects, from preliminary data to publication, support for running SBML models etc. (public SEEK instance)",fairsharing:nnvcr9,"storage, researcher, nels, metadata, micro_biotech, machine_actionability, data_manager"
FAIRshake,https://fairshake.cloud,A System to Evaluate the FAIRness of Digital Objects,,"compliance, data_manager, it_support"
FAIRsharing,https://fairsharing.org/,"A curated, informative and educational resource on data and metadata standards, inter-related to databases and data policies.",fairsharing:2abjs5,"metadata, data_publication, policy_officer, data_manager, researcher, micro_biotech, existing_data"
FigShare,https://figshare.com/,Data publishing platform,fairsharing:drtwnh,"data_publication, biomol_sim, bioimaging_data"
FileZilla,https://filezilla-project.org,A free FTP solution,,"transfer, it_support"
FIP Wizard,https://fip-wizard.readthedocs.io/en/latest/,FIP Wizard is a toolset to facilitate the capture of data in FAIR Convergence Matrix questionnaire prompting communities to explicitly declare their FAIR Implementation Profiles. These profiles can be then stored and published as nanopublications.,,"dm_coordination, dmp, researcher, data_manager"
Free-IPA,https://www.freeipa.org/,FreeIPA is an integrated Identity and Authentication solution for Linux/UNIX networked environments.,,"it_support, transmed"
Freegenes,https://stanford.freegenes.org/collections/open-genes,Repository of IP-free synthetic biological parts,,micro_biotech
GA4GH Data Security Toolkit,https://www.ga4gh.org/genomic-data-toolkit/data-security-toolkit/,Principled and practical framework for the responsible sharing of genomic and health-related data.,,"data_publication, policy_officer, data_manager, it_support, human_data, sensitive"
GA4GH Genomic Data Toolkit,https://www.ga4gh.org/genomic-data-toolkit/,Open standards for genomic data sharing.,,"data_manager, it_support, human_data"
GA4GH Regulatory and Ethics toolkit,https://www.ga4gh.org/genomic-data-toolkit/regulatory-ethics-toolkit/,Framework for Responsible Sharing of Genomic and Health-Related Data,,"data_protection, sensitive, policy_officer, data_manager, it_support, human_data"
Galaxy,https://galaxyproject.org/,"Open, web-based platform for data intensive biomedical research. Whether on the free public server or your own instance, you can perform, reproduce, and share complete analyses.",biotools:galaxy,"nels, marine_assembly, data_analysis, researcher, it_support, ifb, galaxy"
GenBank,https://www.ncbi.nlm.nih.gov/genbank/,A database of genetic sequence information. GenBank may also refer to the data format used for storing information around genetic sequence data.,,micro_biotech
Gene Expression Omnibus (GEO),https://www.ncbi.nlm.nih.gov/geo/,A repository of MIAME-compliant genomics data from arrays and high-throughput sequencing,,"micro_biotech, data_publication, metadata, transfer, ome, bioimaging_data, toxicology_data"
GENEID,https://genome.crg.cat/software/geneid/index.html,Geneid is an ab initio gene finding program used to predict genes along DNA sequences in a large set of organisms.,biotools:geneid,"data_analysis, researcher"
GHS Classification,https://pubchem.ncbi.nlm.nih.gov/ghs/,"GHS (Globally Harmonized System of Classification and Labelling of Chemicals) classification was developed by the United Nations in an attempt to align standards and chemical regulations in different countries. GHS includes criteria for the classification of health, physical and environmental hazards, and what information should be included on labels of hazardous chemicals and safety data sheets.",,toxicology_data
Git,https://git-scm.com/,Distributed version control system designed to handle everything from small to very large projects,,"data_organisation, data_manager, it_support"
GitHub,https://github.com,"Versioning system, used for sharing code, as well as for sharing of small data",fairsharing-coll:bsg-d001160,"data_publication, data_organisation, it_support, data_manager"
GitLab,https://gitlab.com/gitlab-org/gitlab,"GitLab is an open source end-to-end software development platform with built-in version control, issue tracking, code review, CI/CD, and more. Self-host GitLab on your own servers, in a container, or on a cloud provider.",,"data_organisation, data_publication, it_support, data_manager"
Globus,https://www.globus.org,"Globus lets you efficiently, securely, and reliably transfer data directly between systems separated by an office wall or an ocean. Focus on your research and offload your data transfer headaches to Globus",,"transfer, it_support"
GnpIS,https://urgi.versailles.inrae.fr/gnpis/,"A multispecies integrative information system dedicated to plant and fungi pests. It allows researchers to access genetic, phenotypic and genomic data. It is used by both large international projects and the French National Research Institute for Agriculture, Food and Environment.","fairsharing:dw22y3, biotools:gnpis",plants
Google Dataset Search,https://datasetsearch.research.google.com/,Search engine for datasets,,existing_data
Google Drive,https://www.google.com/intl/en_us/drive/,Cloud Storage for Work and Home,,"storage, transfer"
GPCRmd,http://gpcrmd.org/,Repository of GPCR protein simulations,biotools:GPCRmd,"biomol_sim, data_publication"
GRAPE 2.0,https://github.com/guigolab/grape-nf,"The GRAPE pipeline provides an extensive pipeline for RNA-Seq analyses. It allows the creation of an automated and integrated workflow to manage, analyse and visualize RNA-Seq data.",biotools:grape_2.0,data_analysis
Harvard Medical School - ELN Comparison Grid,https://datamanagement.hms.harvard.edu/analyze/electronic-lab-notebooks,ELN Comparison Grid by Hardvard Medical School,,"metadata, identifiers, researcher, data_manager"
Haz-Map,https://haz-map.com/,Haz-Map is an occupational health database that makes available information about the adverse effects of exposures to chemical and biological agents at the workplace. These associations have been established using current scientific evidence.,,toxicology_data
How to License Research Data - DCC,https://www.dcc.ac.uk/guidance/how-guides/license-research-data,Guidelines about how to license research data from Digital Curation Centre,,"licensing, researcher, data_manager, policy_officer"
Human Protein Atlas,https://www.proteinatlas.org/,The Human Protein Atlas contains information for a large majority of all human protein-coding genes regarding the expression and localization of the corresponding proteins based on both RNA and protein data.,fairsharing:j0t0pe,proteomics
HumanMine,https://www.humanmine.org/,"HumanMine integrates many types of human data and provides a powerful query engine, export for results, analysis for lists of data and FAIR access via web services.",biotools:humanmine,"data_organisation, data_manager, researcher, human_data, data_analysis"
iCloud,https://www.icloud.com/,Data sharing,,"storage, data_analysis, transfer"
Identifiers.org,http://identifiers.org,The Identifiers.org Resolution Service provides consistent access to life science data using Compact Identifiers. Compact Identifiers consist of an assigned unique prefix and a local provider designated accession number (prefix:accession).,"biotools:identifiers.org, fairsharing:n14rc8","identifiers, it_support, data_manager"
iGEM Parts Registry,http://parts.igem.org/Main_Page,A collection of standard biological parts to which all entrants in the iGEM competition must submit their parts,,micro_biotech
Image Data Resource (IDR),https://idr.openmicroscopy.org,A repository of image datasets from scientific publications,fairsharing:6wf1zw,"micro_biotech, data_publication, metadata, transfer, ome, bioimaging_data"
Informed Consent Ontology,http://purl.obolibrary.org/obo/ICO.owl,The Informed Consent Ontology (ICO) is an ontology for the informed consent and informed consent process in the medical field.,fairsharing:b9znd5,"it_support, policy_officer, human_data"
International Compilation of Human Research Standards,https://www.hhs.gov/ohrp/sites/default/files/2020-international-compilation-of-human-research-standards.pdf,"The International Compilation of Human Research Standards enumerates over 1,000 laws, regulations, and guidelines (collectively referred to as standards) that govern human subject protections in 133 countries, as well as standards from a number of international and regional organizations",,human_data
International Nucleotide Sequence Database Collaboration (INSDC),http://www.insdc.org,"A collaborative database of genetic sequence datasets from DDBJ, EMBL-EBI and NCBI",,"micro_biotech, data_brokering"
International Society for the Advancement of Cytometry (ISAC),https://isac-net.org/page/Data-Standards,Data standards and formats for reporting flow cytometry data,biotools:NA,micro_biotech
International Union of Biochemistry and Molecular Biology (IUBMB),https://www.qmul.ac.uk/sbcs/iubmb/,Resource for naming standards in biochemistry and molecular biology,,micro_biotech
InterPro,https://www.ebi.ac.uk/interpro/,Functional analysis of protein sequences by classifying them into families and predicting the presence of domains and important sites,fairsharing:pda11d,
IntoGen,https://www.intogen.org/search,IntoGen collects and analyses somatic mutations in thousands of tumor genomes to identify cancer driver genes.,biotools:intogen,"data_analysis, human_data"
Intrinsically disordered proteins ontology (IDPO),https://disprot.org/about,Intrinsically disordered proteins ontology,,"idp, metadata"
IRIS,https://www.epa.gov/iris,The Integrated Risk Information System (IRIS) resource evaluates information on health that might arise after exposure to environmental contaminants.,,toxicology_data
iRODS,https://irods.org/,Integrated Rule-Oriented Data System (iRODS) is open source data management software for a cancer genome analysis workflow.,biotools:irods,"storage, it_support, transmed, bioimaging_data"
ISA-tools,https://isa-tools.org/,"Open source framework and tools helping to manage a diverse set of life science, environmental and biomedical experiments using the Investigation Study Assay (ISA) standard",fairsharing:53gp75,"it_support, data_manager, micro_biotech, machine_actionability"
ISA4J,https://doi.org/10.12688/f1000research.27188.1,Open source software library that can be used to generate a ISA-TAB export from in-house data sets. These comprises e.g. local database or local file system based experimental.,biotools:isa4j,"plants, machine_actionability, plant_pheno_assembly"
ISO/IEC 27001,https://en.wikipedia.org/wiki/ISO/IEC_27001,International information security standard,,"data_protection, policy_officer, human_data"
IUPAC-IUBMB Joint Commission on Biochemical Nomenclature (JCBN),https://www.qmul.ac.uk/sbcs/iupac/jcbn/,A collaborative resource from IUPAC and IUBMB for naming standards in biochemistry,,micro_biotech
JBEI-ICE,https://ice.jbei.org,A registry platform for biological parts,,micro_biotech
Jupyter,https://jupyter.org,"Jupyter notebooks allow to share code, documentation",,"it_support, data_analysis"
Keycloak,https://www.keycloak.org/,Keycloak is an open source identity and data access management solution.,,"it_support, transmed"
LimTox,http://limtox.bioinfo.cnio.es/,"The LiMTox system is a text mining approach that tries to extract associations between compounds and a particular toxicological endpoint at various levels of granularity and evidence types, all inspired by the content of toxicology reports. It integrates direct ranking of associations between compounds and hepatotoxicity through combination of heterogeneous complementary strategies from term co-mention, rules, and patterns to machine learning-based text classification. It also provides indirect associations to hepatotoxicity through the extraction of relations reflecting the effect of compounds at the level of metabolism and liver enzymes.",biotools:limtox,toxicology_data
Linked Open Vocabularies (LOV),https://lov.linkeddata.es/dataset/lov/,Web portal for finding ontologies,,"metadata, data_manager, researcher"
List of Prokaryotic names with Standing in Nomenclature (LPSN),https://lpsn.dsmz.de,A database of prokaryote specific biodiversity information,,micro_biotech
LUMI,https://www.lumi-supercomputer.eu/,EuroHPC world-class supercomputer,,"data_analysis, researcher, it_support, csc"
maDMP - Research Bridge,https://library.ust.hk/sc/machine-actionable-dmp/,Machine-Actionable Data Management Plan | Webinar (2016) on making a good data management plan.,,"dmp, it_support"
MarDB,https://mmp2.sfb.uit.no/mardb/,"MarDB includes all non-complete marine microbial genomes regardless of level of completeness. Each entry contains 120 metadata fields including information about sampling environment or host, organism and taxonomy, phenotype, pathogenicity, assembly and annotation.",biotools:mardb,"marine_assembly, data_analysis"
MarFun,https://mmp2.sfb.uit.no/marfun/,MarFun is a manually curated marine fungi genome database.,,"marine_assembly, data_analysis"
Marine metagenomics portal,https://mmp2.sfb.uit.no/,High-quality curated and freely accessible microbial genomics and metagenomics resources for the marine scientific community,biotools:mmp,marine_assembly
MarRef,https://mmp2.sfb.uit.no/marref/,"MarRef is a manually curated marine microbial reference genome database that equenced genomes. Each entry contains 120 metadata fields including information about sampling environment or host, organism and taxonomy, phenotype, pathogenicity, assembly and annotation information",biotools:marref,marine_assembly
MemProtMD,http://memprotmd.bioch.ox.ac.uk/,Database of over 5000 intrinsic membrane protein structures,,biomol_sim
Mendeley data,https://data.mendeley.com/,"Multidisciplinary, free-to-use open repository specialized for research data",fairsharing:3epmpp,"data_publication, biomol_sim"
MetabolomeXchange,http://www.metabolomexchange.org/site/,A repository of genomics data relating to the study of the metabolome,,"micro_biotech, data_publication"
MIADE,https://www.psidev.info/intrinsically-disordered-proteins-workgroup,Minimum Information About Disorder Experiments (MIADE) standard,,"metadata, researcher, data_manager, idp"
MIAPPE,https://www.miappe.org/,Minimum Information About a Plant Phenotyping Experiment,fairsharing:nd9ce9,"metadata, researcher, data_manager, plants, plant_geno_assembly, plant_pheno_assembly"
Microsoft Azure,https://azure.microsoft.com/en-gb/,Cloud storage and file sharing service from Microsoft,,"storage, it_support, transfer"
Microsoft OneDrive,https://www.microsoft.com/en-us/microsoft-365/onedrive/online-cloud-storage,Cloud storage and file sharing service from Microsoft,,"storage, it_support"
MIGS/MIMS,https://genomicsstandardsconsortium.github.io/mixs/,Minimum Information about a (Meta)Genome Sequence,fairsharing:va1hck,"metadata, researcher, data_manager, marine, micro_biotech"
MINT,https://mint.bio.uniroma2.it/,"MINT, the Molecular INTeraction database, focuses on experimentally verified protein-protein interactions mined from the scientific literature by expert curators",fairsharing:2bdvmk,
MIxS,https://gensc.org/mixs/,Minimum Information about any (x) Sequence,fairsharing:9aa0zp,"metadata, researcher, data_manager, marine, plant_geno_assembly"
MobiDB,https://mobidb.org/,A database of protein disorder and mobility annotations,biotools:mobidb,"idp, researcher"
MoDEL,https://mmb.irbbarcelona.org/MoDEL/,Database of Protein Molecular Dynamics simulations representing different structural clusters of the PDB,"biotools:model, fairsharing:NA",biomol_sim
MoDEL Covid19,https://bioexcel-cv19.bsc.es/#/,Database of COVID-19 related atomistic Molecular Dynamic Trajectories,,biomol_sim
MoDEL-CNS,https://mmb.irbbarcelona.org/MoDEL-CNS/#/,Repository for Central Nervous System-related mainly membrane protein MD simulations,,"biomol_sim, data_publication"
ModelArchive,https://www.modelarchive.org/,Repository for theoretical models of macromolecular structures with DOIs for models,fairsharing:tpqndj,"biomol_sim, struct_bioinfo, data_publication"
Molgenis,https://molgenis.gitbooks.io/molgenis/content/,"Molgenis is a modular web application for scientific data. Molgenis provides researchers with user friendly and scalable software infrastructures to capture, exchange, and exploit the large amounts of data that is being produced by scientific organisations all around the world.",biotools:molgenis,"identifiers, it_support, data_manager"
MolMeDB,https://molmedb.upol.cz/,Database about interactions of molecules with membranes,"biotools:MolMeDB, fairsharing:cwzk3c",biomol_sim
MONARC,https://open-source-security-software.net/project/MONARC,A risk assessment tool that can be used to do Data Protection Impact Assessments,,"data_protection, policy_officer, human_data, transmed"
MRI2DICOM,https://github.com/szullino/XNAT-PIC,"a Magnetic Resonance Imaging (MRI) converter from ParaVision® (Bruker, Inc. Billerica, MA) file format to DICOM standard",,"researcher, data_manager, xnat-pic"
Multi-Crop Passport Descriptor (MCPD),https://www.bioversityinternational.org/e-library/publications/detail/faobioversity-multi-crop-passport-descriptors-v21-mcpd-v21/,The Multi-Crop Passport Descriptor is the metadata standard for plant genetic resources maintained ex situ by genbanks.,"biotools:NA, fairsharing:hn155r","metadata, researcher, it_support, policy_officer, plants"
MyTardis,http://www.mytardis.org/,A file-system based platform handling the transfer of data,,"data_manager, transfer, bioimaging_data"
National Center for Biotechnology Information (NCBI),https://www.ncbi.nlm.nih.gov,"Online database hosting a vast amount of biotechnological information including nucleic acids, proteins, genomes and publications. Also boasts integrated tools for analysis.",,micro_biotech
NBP,https://www.cdc.gov/biomonitoring/,The National Biomonitoring Program (NBP) is a public resource that offers an assessment of nutritional status and the exposure of the U.S. population to environmental chemicals and toxic substances.,,toxicology_data
NCBI Taxonomy,https://www.ncbi.nlm.nih.gov/Taxonomy/taxonomyhome.html/,NCBI's taxonomy browser is a database of biodiversity information,,micro_biotech
NCIMB,https://www.ncimb.com/culture-collection/,"Hosts information relating to strains, cultures and more",,micro_biotech
Nettskjema,https://nettskjema.no/,"Form and survey tool, also for sensitive data",,"sensitive, tsd"
NextCloud,https://nextcloud.com,"As fully on-premises solution, Nextcloud Hub provides the benefits of online collaboration without the compliance and security risks.",,"storage, it_support, transfer"
Nextflow,https://www.nextflow.io,Nextflow is a framework for data analysis workflow execution,,"it_support, data_analysis"
NMRlipids,http://nmrlipids.blogspot.com/,Repository for lipid MD simulations to validate force fields with NMR data,,"biomol_sim, data_publication"
NPDS,https://www.aapcc.org/national-poison-data-system,The National Poison Data System (NPDS) is a resource that provides poisson exposure occurring in the US and some freely associated states.,,toxicology_data
OHDSI,https://ohdsi.org/,"Multi-stakeholder, interdisciplinary collaborative to bring out the value of health data through large-scale analytics. All our solutions are open-source.",biotools:ohdsi,"researcher, data_manager, data_analysis, storage, transmed, toxicology_data"
OMERO,https://www.openmicroscopy.org,"OMERO is an open-source client-server platform for managing, visualizing and analyzing microscopy images and associated metadata","biotools:omero, fairsharing:NA","metadata, data_manager, it_support, storage, ome, bioimaging_data"
OmicsDI,https://www.omicsdi.org,"Omics Discovery Index (OmicsDI) provides a knowledge discovery framework across heterogeneous omics data (genomics, proteomics, transcriptomics and metabolomics)","biotools:omicsdi, fairsharing:re1278","existing_data, proteomics"
OMOP-CDM,https://ohdsi.github.io/CommonDataModel/,OMOP is a common data model for the harmonisation for of observational health data.,,transmed
Ontobee,http://www.ontobee.org,A web portal to search and visualise ontologies,,"metadata, data_manager, researcher"
ONTOMATON,https://github.com/ISA-tools/OntoMaton,OntoMaton facilitates ontology search and tagging functionalities within Google Spreadsheets.,,"researcher, data_manager, it_support, metadata, identifiers"
