name,link,description,registry,tags
Privacy Impact Assessment Tool,https://privaon.com/services/privacy-impact-assessment-tool/,"Privacy Impact Assessment Tool is a software, that allows you to carry out Privacy Impact Assessment (PIA) independently.",,"data protection, policy officer, human data"
R Markdown,https://rmarkdown.rstudio.com,"R Markdown documents are fully reproducible. Use a productive notebook interface to weave together narrative text and code to produce elegantly formatted output. Use multiple languages including R, Python, and SQL.",,"data analysis, researcher"
RD-Connect Genome Phenome Analysis Platform,https://rd-connect.eu/what-we-do/omics/gpap/,The RD-Connect GPAP is an online tool for diagnosis and gene discovery in rare disease research.,,"researcher, human data"
RDA Standards,https://rd-alliance.github.io/metadata-directory/standards/,"Directory of standard metadata, divided into different research areas",,"metadata, researcher, data manager"
Renamer4Mac,https://renamer.com/,File renaming software for Mac,,"data organisation, data manager, researcher"
Repository Finder,https://repositoryfinder.datacite.org,Repository Finder can help you find an appropriate repository to deposit your research data. The tool is hosted by DataCite and queries the re3data registry of research data repositories.,,"data publication, researcher, data manager"
Research Data Management Platform (RDMP),https://www.dundee.ac.uk/hic/researchdatamanagementplatform/,"Data management platform for automated loading, storage, linkage and provision of data sets",biotools:rdmp,"storage, IT support"
Research Management Plan,https://researcheracademy.elsevier.com/research-preparation/research-data-management/creating-good-research-data-management-plan,Machine actionable DMPs.,,"DMP, researcher, data manager"
Research Object Crate (RO-Crate),https://w3id.org/ro/crate,"RO-Crate is a lightweight approach to packaging research data with their metadata, using schema.org. An RO-Crate is a structured archive of all the items that contributed to the research outcome, including their identifiers, provenance, relations and annotations.",fairsharing:wUoZKE,"metadata, storage, data organisation, data manager, researcher"
Reva,https://reva.link/,Reva connects cloud storages and application providers,,"data analysis, transfer"
Rightfield,https://rightfield.org.uk,RightField is an open-source tool for adding ontology term selection to Excel spreadsheets,,"researcher,metadata,data manager"
Rstudio,https://rstudio.com,"Rstudio notebooks allow to share code, documentation",,"data analysis, IT support, researcher"
Rucio,https://rucio.cern.ch/,Rucio - Scientific Data Management,,"storage, data analysis, transfer"
SASBDB,https://www.sasbdb.org/,Small Angle Scattering Biological Data Bank,,"IDP, researcher"
Schemapedia,https://schemapedia.com,Web portal for finding ontologies,,"metadata, data manager, researcher"
ScienceMesh,https://sciencemesh.io/,ScienceMesh - frictionless scientific collaboration and access to research services,,"storage, data analysis, transfer"
Scientific Data's Recommended Repositories,https://www.nature.com/sdata/policies/repositories,"List of respositories recommended by Scinetific Data, contains both discipline-specific and general repositories.",,"data publication, researcher, data manager, IT support"
SeaFile,https://www.seafile.com/,SeaFile File Synchronization and Share Solution,,"storage, transfer"
SEEK,https://seek4science.org/,"Data, model and SOPs management for projects, from preliminary data to publication, support for running SBML models etc.",biotools:seek,"storage, IT support, nels"
SIFTS,https://www.ebi.ac.uk/pdbe/docs/sifts/,"Structure integration with function, taxonomy and sequence",,"researcher, IDP"
Silva,https://www.arb-silva.de/,"SILVA provides comprehensive, quality checked and regularly updated datasets of aligned small (16S/18S, SSU) and large subunit (23S/28S, LSU) ribosomal RNA (rRNA) sequences for all three domains of life (Bacteria, Archaea and Eukarya).",fairsharing:5vtYGG,
Singularity,https://sylabs.io,Singularity is a container platform.,,"IT support, data analysis"
Snakemake,https://snakemake.github.io,Snakemake is a framework for data analysis workflow execution,biotools:snakemake,"IT support, data analysis"
STRING,https://string-db.org/,Known and predicted protein-protein interactions.,fairsharing:9b7wvk,
The European Genome-phenome Archive (EGA),https://ega-archive.org/,EGA is a service for permanent archiving and sharing of all types of personally identifiable genetic and phenotypic data resulting from biomedical research projects,"biotools:ega, fairsharing:mya1ff","data publication, human data, policy officer"
The Genomic Standards Consortium (GSC),https://gensc.org/mixs/,Minimum Information about any (x) Sequence,fairsharing:9aa0zp,"metadata, researcher, IT support, policy officer, human data"
The Open Biological and Biomedical Ontology (OBO) Foundry,http://obofoundry.org,Collaborative effort to develob interoperable ontologies for the biological sciences,fairsharing:biodbcore-001083,"metadata, data manager, researcher"
Tryggve ELSI Checklist,https://scilifelab-data-guidelines.readthedocs.io/en/latest/docs/general/sensitive_data.html,"A list of Ethical, Legal, and Societal Implications (ELSI) to consider for research projects on human subjects",,"sensitive, policy officer, data manager, human data"
UniProt,https://www.uniprot.org/,Comprehensive resource for protein sequence and annotation data,fairsharing:s1ne3g,"metadata, researcher, IDP"
Wellcome Open Research - Data Guidelines,https://wellcomeopenresearch.org/for-authors/data-guidelines,"Wellcome Open Research requires that the source data underlying the results are made available as soon as an article is published. This page provides information about data you need to include, where your data can be stored, and how your data should be presented.",,"data publication, researcher, data manager"
Zenodo,https://zenodo.org/,Generalist research data repository built and developed by OpenAIRE and CERN,fairsharing:wy4egf,"data publication, biomol sim"
